﻿system_reference_number,facility_name,unit_name_and_description,form_score,patient_comments,Sentiment Score,Translated Text,Misspelled Words
OP-DPOS-2023-225-458728,Leratong Regional Hospital,Eye clinic,0.28,most people are sent back to do the vitals and they do not know where to start after they recieve the file,0.2732,most people are sent back to do the vitals and they do not know where to start after they recieve the file,recieve
OP-DPOS-2023-225-411582,Leratong Regional Hospital,Eye clinic,0.22,The nurses are friendly and they care about our well being,0.8176,The nurses are friendly and they care about our well being,
OP-DPOS-2023-225-906073,Leratong Regional Hospital,Eye clinic,1,"The service is good, keep it up",0.4404,"The service is good, keep it up","good,"
OP-DPOS-2023-225-311105,Leratong Regional Hospital,Eye clinic,1,Please guide patient to do vitals after collecting file from reception,0.5267,Please guide patient to do vitals after collecting file from reception,
OP-DPOS-2023-225-721196,Leratong Regional Hospital,Eye clinic,1,i was treated very well at Leratong. ,0.3384,i was treated very well at Leratong. ,leratong.
OP-DPOS-2023-225-344153,Leratong Regional Hospital,OPD,0.78,WAITING PERIOD IN HOSPITAL OF 150 MIN CAN BE REDUCED TO AT LEAST 60MIN TO 90MIN MANY TIMES WE COME EARLY AND GO HME AFTER 6HRS,0.0,WAITING PERIOD IN HOSPITAL OF 150 MIN CAN BE REDUCED TO AT LEAST 60MIN TO 90MIN MANY TIMES WE COME EARLY AND GO HME AFTER 6HRS,"60min,6hrs,90min,hme"
OP-DPOS-2023-225-090954,Leratong Regional Hospital,AUDIOLOGY,0.44,CURRENTLY THE PERSON WHO WAS HELPING WAS  VERY MUCH WELCOMING AND NICE.SHE EPLAINED EVERYTHING TO ME AND I WAS ABLE TO UNDERSTAND.,0.6573,CURRENTLY THE PERSON WHO WAS HELPING WAS  VERY MUCH WELCOMING AND NICE.SHE EPLAINED EVERYTHING TO ME AND I WAS ABLE TO UNDERSTAND.,"understand.,nice.she,eplained"
OP-DPOS-2023-398-278837,Tembisa Tertiary Hospital,Eye Clinic,1,I had an operation and my eye is recovering very well.,0.3384,I had an operation and my eye is recovering very well.,well.
OP-DPOS-2023-398-009173,Tembisa Tertiary Hospital,Eye Clinic,1,"I had something in my eye then the doctor removed it, I'm so happy.",0.6948,"I had something in my eye then the doctor removed it, I'm so happy.","it,,happy."
OP-DPOS-2023-398-508101,Tembisa Tertiary Hospital,Eye Clinic,0.94,I was been served with a smile,0.3612,I was been served with a smile,
OP-DPOS-2023-398-976776,Tembisa Tertiary Hospital,Eye Clinic,1,The communication is good,0.4404,The communication is good,
OP-DPOS-2023-398-830786,Tembisa Tertiary Hospital,Eye Clinic,1,I was been served well.,0.2732,I was been served well.,well.
OP-DPOS-2023-398-120573,Tembisa Tertiary Hospital,Eye Clinic,1,I cannot complain the service was good.,0.6136,I cannot complain the service was good.,good.
OP-DPOS-2023-398-354723,Tembisa Tertiary Hospital,Eye Clinic,1,I was been served with a smile.,0.3612,I was been served with a smile.,smile.
OP-DPOS-2023-225-861347,Leratong Regional Hospital,ANC,0.44,THE NURSES TREATED US VERY WELL AND THIER SERVICE IS REALLY GOOD AND FAST.,0.6794,THE NURSES TREATED US VERY WELL AND THIER SERVICE IS REALLY GOOD AND FAST.,"fast.,thier"
OP-DPOS-2023-398-456097,Tembisa Tertiary Hospital,Eye Clinic,1,"I was had something in my eye then the doctor removed it, I am so happy with the service",0.6948,"I was had something in my eye then the doctor removed it, I am so happy with the service","it,"
OP-DPOS-2023-225-637821,Leratong Regional Hospital,ANC,0.83,HONESTLY SPEAKING I HAVE NO COMPLAINT ABOUT THE STUFF. I HAVE RECIEVED THE BEST CARE FROM THEM ALL. THANK YOU.,0.8591,HONESTLY SPEAKING I HAVE NO COMPLAINT ABOUT THE STUFF. I HAVE RECIEVED THE BEST CARE FROM THEM ALL. THANK YOU.,"recieved,stuff.,you.,all."
OP-DPOS-2023-398-151131,Tembisa Tertiary Hospital,Eye Clinic,1,Im happy with their service,0.5719,Im happy with their service,
OP-DPOS-2023-398-266950,Tembisa Tertiary Hospital,Eye Clinic,1,Served with a smile.,0.3612,Served with a smile.,smile.
OP-DPOS-2023-225-831638,Leratong Regional Hospital,ANC,0.39,THEY HAVE BEEN GOOD TO ME AND EVEN THE TREATMENT WAS WELL.,0.6124,THEY HAVE BEEN GOOD TO ME AND EVEN THE TREATMENT WAS WELL.,well.
OP-DPOS-2023-398-073569,Tembisa Tertiary Hospital,WHC,0.89,"There service a good, That its everything was wow",0.7717,"There service a good, That its everything was wow","good,"
OP-DPOS-2023-225-250903,Leratong Regional Hospital,ANC,0.39,THE SERVISE WAS GOOD,0.4404,THE SERVISE WAS GOOD,servise
OP-DPOS-2023-225-348871,Leratong Regional Hospital,ANC,0.5,DOCTORS AND NURSES ARE GOOD TO ME AND THEY ARE SO WELCOMING.,0.7264,DOCTORS AND NURSES ARE GOOD TO ME AND THEY ARE SO WELCOMING.,welcoming.
OP-DPOS-2023-398-030190,Tembisa Tertiary Hospital,Eye Clinic,1,Now I understand everything about my eye ,0.0,Now I understand everything about my eye ,
OP-DPOS-2023-398-234450,Tembisa Tertiary Hospital,Eye Clinic,1,Everything was well explained about my eyes.,0.2732,Everything was well explained about my eyes.,eyes.
OP-DPOS-2023-398-968909,Tembisa Tertiary Hospital,Eye Clinic,1,Served wuth a smile.,0.3612,Served wuth a smile.,"wuth,smile."
OP-DPOS-2023-225-240051,Leratong Regional Hospital,RENAL,0.89,"SO FOR I AM VER HAPPY WITH STUFF OF RENAL. 

THANK YOU",0.7351,"SO FOR I AM VER HAPPY WITH STUFF OF RENAL. 

THANK YOU",renal.
OP-DPOS-2023-398-564028,Tembisa Tertiary Hospital,Eye Clinic,1,Had a good service.,0.4404,Had a good service.,service.
OP-DPOS-2023-398-953126,Tembisa Tertiary Hospital,Eye Clinic,1,Served well.,0.2732,Served well.,well.
OP-DPOS-2023-398-592956,Tembisa Tertiary Hospital,Eye Clinic,1,I had a great service.,0.6249,I had a great service.,service.
OP-DPOS-2023-398-240577,Tembisa Tertiary Hospital,Eye Clinic,1,Serving with smile.,0.3612,Serving with smile.,smile.
OP-DPOS-2023-398-487779,Tembisa Tertiary Hospital,Eye Clinic,1,I'M HAPPY WITH THEIR HEALTH SERVICE,0.5719,I'M HAPPY WITH THEIR HEALTH SERVICE,
OP-DPOS-2023-398-743082,Tembisa Tertiary Hospital,Eye Clinic,1,Excellent Service,0.5719,Excellent Service,
OP-DPOS-2023-398-675451,Tembisa Tertiary Hospital,Eye Clinic,1,Service good.,0.4404,Service good.,good.
OP-DPOS-2023-398-010297,Tembisa Tertiary Hospital,Eye Clinic,1,Service is good.,0.4404,Service is good.,good.
OP-DPOS-2023-398-916915,Tembisa Tertiary Hospital,Eye Clinic,1,I'm happy with their service,0.5719,I'm happy with their service,
OP-DPOS-2023-398-082320,Tembisa Tertiary Hospital,Eye Clinic,1,Good service,0.4404,Good service,
OP-DPOS-2023-398-500464,Tembisa Tertiary Hospital,Eye Clinic,1,EXCELLENT SERVICE,0.5719,Excellent service,
OP-DPOS-2023-398-789089,Tembisa Tertiary Hospital,Eye Clinic,1,Did operation now I can see.,0.0,Did operation now I can see.,see.
OP-DPOS-2023-398-574962,Tembisa Tertiary Hospital,Eye Clinic,1,Served well and the service was good.,0.6124,Served well and the service was good.,good.
OP-DPOS-2023-398-246799,Tembisa Tertiary Hospital,Eye Clinic,1,Well welomed and best service.,0.743,Well welomed and best service.,"welomed,service."
OP-DPOS-2023-398-287433,Tembisa Tertiary Hospital,Eye Clinic,1,Service is good.,0.4404,Service is good.,good.
OP-DPOS-2023-398-292216,Tembisa Tertiary Hospital,Eye Clinic,1,I'm happy with their service,0.5719,I'm happy with their service,
OP-DPOS-2023-398-767203,Tembisa Tertiary Hospital,Eye Clinic,1,Good service,0.4404,Good service,
OP-DPOS-2023-398-844085,Tembisa Tertiary Hospital,Eye Clinic,1,EXCELLENT SERVICE,0.5719,Excellent service,
OP-DPOS-2023-398-027034,Tembisa Tertiary Hospital,Eye Clinic,1,Did operaion now I Can see.,0.0,Did operaion now I Can see.,"see.,operaion"
OP-DPOS-2023-398-617586,Tembisa Tertiary Hospital,Eye Clinic,1,First time coming to eye clinic and I had been assessed by the doctorand the staff had helped me and served me with a smile.,0.3612,First time coming to eye clinic and I had been assessed by the doctorand the staff had helped me and served me with a smile.,"smile.,doctorand"
OP-DPOS-2023-398-472537,Tembisa Tertiary Hospital,Eye Clinic,1,"I come with my injured Right eye now it has been healed, I had a good service",0.0516,"I come with my injured Right eye now it has been healed, I had a good service","healed,"
OP-DPOS-2023-398-941638,Tembisa Tertiary Hospital,Eye Clinic,1,Served with a smile,0.3612,Served with a smile,
OP-DPOS-2023-398-032440,Tembisa Tertiary Hospital,Eye Clinic,1,Good service,0.4404,Good service,
OP-DPOS-2023-398-853247,Tembisa Tertiary Hospital,Eye Clinic,1,I was served with a smile,0.3612,I was served with a smile,
OP-DPOS-2023-398-830273,Tembisa Tertiary Hospital,Eye Clinic,1,I had an operation and my eye is recovering very well.,0.3384,I had an operation and my eye is recovering very well.,well.
OP-DPOS-2023-398-472358,Tembisa Tertiary Hospital,Eye Clinic,1,Good communication,0.4404,Good communication,
OP-DPOS-2023-398-145201,Tembisa Tertiary Hospital,Wound Clinic ,1,i am a mother of Lethabo they treat me well.,0.5859,i am a mother of Lethabo they treat me well.,"lethabo,well."
OP-DPOS-2023-398-806645,Tembisa Tertiary Hospital,Wound Clinic ,1,they are so nice to my child,0.5598,they are so nice to my child,
OP-DPOS-2023-398-893700,Tembisa Tertiary Hospital,Wound Clinic ,1,"Since i stared to come to this place the nurses they talk good to me and son. He was to be treated to this clinic, i didn't not see any bad thing at all they are good. Thank you so much for  taking good care for us May they contiune doing that to others ",0.9455,"Since i stared to come to this place the nurses they talk good to me and son. He was to be treated to this clinic, i didn't not see any bad thing at all they are good. Thank you so much for  taking good care for us May they contiune doing that to others ","contiune,son.,good.,clinic,"
OP-DPOS-2023-398-274161,Tembisa Tertiary Hospital,Wound Clinic ,1,they are so nice to my child.,0.5598,they are so nice to my child.,child.
OP-DPOS-2023-398-031329,Tembisa Tertiary Hospital,Wound Clinic ,1,"The nurses made me feel at home. i saw great changes the first week i came here, nurses know their job very well. Good job",0.8648,"The nurses made me feel at home. i saw great changes the first week i came here, nurses know their job very well. Good job","here,,well.,home."
OP-DPOS-2023-398-639889,Tembisa Tertiary Hospital,Wound Clinic ,0.83,nurses anddoctors here are friendly and we are treated properly ,0.4939,nurses anddoctors here are friendly and we are treated properly ,anddoctors
OP-DPOS-2023-398-955774,Tembisa Tertiary Hospital,Wound Clinic ,1,I'm happy with the help i got from the doctors and the nurses. Thank you,0.836,I'm happy with the help i got from the doctors and the nurses. Thank you,nurses.
OP-DPOS-2023-398-772469,Tembisa Tertiary Hospital,Wound Clinic ,1,I am happy with the service i got from the wound clinic.  was treated with respect and my wound is healed.,0.7783,I am happy with the service i got from the wound clinic.  was treated with respect and my wound is healed.,"healed.,clinic."
OP-DPOS-2023-398-311248,Tembisa Tertiary Hospital,Wound Clinic ,0.83,I have an exellent care .Thank you ,0.6908,I have an exellent care .Thank you ,".thank,exellent"
OP-DPOS-2023-398-404349,Tembisa Tertiary Hospital,Wound Clinic ,0.83,Bangiphathe Kahe kakhulu ngiyabonga usizo lwenu lingiphathe kahle ngibonga uthando lwenu ,0.0,Bangiphathe kahe kakhulu ngiyabonga usizo lwenu lingiphathe,"ngiyabonga,kahe,bangiphathe,lingiphathe,kakhulu,lwenu,usizo"
OP-DPOS-2023-398-431974,Tembisa Tertiary Hospital,Wound Clinic ,1,"i was well assisted from day one , my wound looks so much better. the staff i weloming ",0.6461,"i was well assisted from day one , my wound looks so much better. the staff i weloming ","weloming,better."
OP-DPOS-2023-398-998483,Tembisa Tertiary Hospital,Wound Clinic ,0.89,"Never had a chance to make use of them.
Ward to be compelted to hospital emergancy power supply during loadshedding ",-0.1877,"Never had a chance to make use of them.
Ward to be compelted to hospital emergancy power supply during loadshedding ","compelted,emergancy,them.,loadshedding"
OP-DPOS-2023-398-621280,Tembisa Tertiary Hospital,Wound Clinic ,1,Tsakani Portia Mahlaule mina nikomeke kahle golfu xeem nikhensa tirhisano wati nurse ta mina na kakhurli lowu taka minikkoma kahle yanani mahlweni mikomisa sweswo vavatiyi vanwina nakhensa.,-0.6124,Tsakani Portia Mahlaule Mina I stop kahle Golfu Xeem Nikhensa Tirhisano Nurse Nurse Ta Mina and Kakhurli Lowu Waste Minikkoma Kahle Yinani Mahlweni Mikomisa Sweswo Vavatiyi Vanwina Nakhensa.,"mahlaule,lowu,minikkoma,mikomisa,vanwina,golfu,vavatiyi,nakhensa.,xeem,kahle,tirhisano,sweswo,nikhensa,yinani,mahlweni,tsakani,kakhurli"
OP-DPOS-2023-398-842995,Tembisa Tertiary Hospital,Wound Clinic ,1,"Sister phuthi was so kind and smile all the time.I am very happy she is the special sister .

All the nurse from wound clinc are so kind smill always. I am so happy  i never find the problem 100% to all of them ",0.9762,"Sister phuthi was so kind and smile all the time.I am very happy she is the special sister .

All the nurse from wound clinc are so kind smill always. I am so happy  i never find the problem 100% to all of them ","100%,smill,time.i,clinc,phuthi,always."
OP-DPOS-2023-398-031322,Tembisa Tertiary Hospital,Wound Clinic ,1,ka mo tliniking bare tswere btse lebile reya fola and ba tlhalosa  tsotlhe tse a disomishang ,0.0,ka mo tliniking bare tswere btse lebile reya fola and ba tlhalosa  tsotlhe tse a disomishang ,"tsotlhe,tswere,lebile,fola,reya,disomishang,tlhalosa,tliniking,btse"
OP-DPOS-2023-398-461335,Tembisa Tertiary Hospital,Wound Clinic ,1,i was treated in a good manner with espect and i highly appeciate thir help i can even see a big improvment on my wound . ,0.7063,i was treated in a good manner with espect and i highly appeciate thir help i can even see a big improvment on my wound . ,"appeciate,improvment,thir,espect"
OP-DPOS-2023-398-147262,Tembisa Tertiary Hospital,Wound Clinic ,0.83,Bare tshwere hantle bare hlokometse nako le nako ,0.0,Bare Tshwere Hantle Bare Hlokometse Nako Le Nako,"hlokometse,hantle,nako,tshwere"
OP-DPOS-2023-398-741358,Tembisa Tertiary Hospital,Wound Clinic ,0.89,Mangiphthe kahle lapha wound  clinic ,0.0,Mangiphthe kahle lapha wound  clinic ,"mangiphthe,kahle,lapha"
OP-DPOS-2023-398-292343,Tembisa Tertiary Hospital,Wound Clinic ,1,"Ba nswere ga botse.
Basega le nna babutsisa maphelo banyaka go tseba gore ke phela bjwang. ke batho babotsi kudu rephela ga bptse le bona.",0.0,"Ba nswere ga botse.
Basega le nna babutsisa maphelo banyaka go tseba gore ke phela bjwang.Ke Bath Babotsi Kudu Rephela ga Bptse Le Bona.","banyaka,bptse,babotsi,babutsisa,rephela,tseba,phela,maphelo,botse.,basega,nswere,bona.,bjwang.ke"
OP-DPOS-2023-398-933514,Tembisa Tertiary Hospital,Wound Clinic ,0.89,"Thanks you for having me on wound clinc . 
 good service ",0.7003,"Thanks you for having me on wound clinc . 
 good service ",clinc
OP-DPOS-2023-398-959254,Tembisa Tertiary Hospital,Wound Clinic ,0.89,"we have been  attending at the Wound clinic for 2 years and we have never encounted negativeness from the nurses and the doctors, we get exllent job fro the nurses with a kindness and care the area is well kept clean at all times .",0.875,"we have been  attending at the Wound clinic for 2 years and we have never encounted negativeness from the nurses and the doctors, we get exllent job fro the nurses with a kindness and care the area is well kept clean at all times .","encounted,doctors,,exllent,negativeness"
OP-DPOS-2023-398-233564,Tembisa Tertiary Hospital,Wound Clinic ,0.94,"caring in the clinic it is in imaculate condition which is the most satistfing . Althog i find a challen in understanding, the nature of the wound and the progess. It s more explaned to my satifaction. ",0.4939,"caring in the clinic it is in imaculate condition which is the most satistfing . Althog i find a challen in understanding, the nature of the wound and the progess. It s more explaned to my satifaction. ","althog,imaculate,s,explaned,understanding,,progess.,satistfing,satifaction.,challen"
OP-DPOS-2023-398-293812,Tembisa Tertiary Hospital,Wound Clinic ,0.94,"i'M being treated good , i feel t home . im happy about the way they treated me . Sisiter phuti and her group Hilda Tsaki Mmapabale . my wound is improving ",0.8555,"i'M being treated good , i feel t home . im happy about the way they treated me . Sisiter phuti and her group Hilda Tsaki Mmapabale . my wound is improving ","tsaki,mmapabale,phuti,sisiter,t"
OP-DPOS-2023-398-416861,Tembisa Tertiary Hospital,Wound Clinic ,0.83,Baleli bitse thomotsa ka ngwana waka nka rata go bale boga se badirileng o ngwananeng ke bono di phetogo ka morago wa gore a tsewe,0.0,Baleli bitse thomotsa ka ngwana waka nka rata go bale boga se badirileng or bono ke bono di phetogo ka mogo wa gore a tsewe,"badirileng,nka,baleli,ngwana,tsewe,thomotsa,phetogo,mogo,rata,bitse,boga"
OP-DPOS-2023-398-496787,Tembisa Tertiary Hospital,Wound Clinic ,1,always friedly and helpful also concerned and caring ,0.7184,always friedly and helpful also concerned and caring ,friedly
OP-DPOS-2023-398-331068,Tembisa Tertiary Hospital,Wound Clinic ,0.83,"ke lebohatshwaro ye ke tshwerweng ka youn, barata batho,amen ",0.0,"to Lebohatshwaro Ye to Tshwerweng Ka Youn, Barata Batho, Amen","tshwerweng,lebohatshwaro,youn,,batho,,barata"
OP-DPOS-2023-398-985490,Tembisa Tertiary Hospital,Wound Clinic ,1,i was treated vry well and the nurses was very good with us . Thank you. ,0.7778,i was treated vry well and the nurses was very good with us . Thank you. ,"you.,vry"
OP-DPOS-2023-398-774817,Tembisa Tertiary Hospital,Wound Clinic ,1, I would reccoment Tembisa Hospital as the best hospital when it come to bringing sections and i like the way the nurses and the doctors treat their patients well. I am happy with their service. ,0.9349, I would reccoment Tembisa Hospital as the best hospital when it come to bringing sections and i like the way the nurses and the doctors treat their patients well. I am happy with their service. ,"reccoment,service.,well.,tembisa"
OP-DPOS-2023-398-607394,Tembisa Tertiary Hospital,Wound Clinic ,0.89,"nice to come here , friendly warm, not a lot of people . nea, well dressed. best place in a hospital ",0.9217,"nice to come here , friendly warm, not a lot of people . nea, well dressed. best place in a hospital ","dressed.,warm,,nea,"
OP-DPOS-2023-398-678310,Tembisa Tertiary Hospital,Wound Clinic ,0.78,The staff is very friendly ,0.5413,The staff is very friendly ,
OP-DPOS-2023-398-220458,Tembisa Tertiary Hospital,Wound Clinic ,0.94, i would like to thank the nurses of the wound clinic for the care they gave us . and i will  like to tell them to continiue doing the great work. i am happy about the service they gave us. May God bless you all the sisters and keep doing the great job. ,0.9788, i would like to thank the nurses of the wound clinic for the care they gave us . and i will  like to tell them to continiue doing the great work. i am happy about the service they gave us. May God bless you all the sisters and keep doing the great job. ,"us.,work.,continiue,job."
OP-DPOS-2023-398-099645,Tembisa Tertiary Hospital,Wound Clinic ,0.83,The progress on my gaugther  is making me appy. The nurses service is very good to  my daugther . Thank you so much ,0.8173,The progress on my gaugther  is making me appy. The nurses service is very good to  my daugther . Thank you so much ,"appy.,gaugther"
OP-DPOS-2023-398-862560,Tembisa Tertiary Hospital,Wound Clinic ,1,Thank you my child is discharged am happy they did a good job with her wound ,0.8442,Thank you my child is discharged am happy they did a good job with her wound ,
OP-DPOS-2023-398-425927,Tembisa Tertiary Hospital,Wound Clinic ,0.89,i am very happy with the treatment they gave my son. he was burntnow he is ok.,0.7346,i am very happy with the treatment they gave my son. he was burntnow he is ok.,"ok.,son.,burntnow"
OP-DPOS-2023-398-806612,Tembisa Tertiary Hospital,Wound Clinic ,0.94,"I want  to thank the sisters for their help to my child, They help me with a smle on thier face and a happy heart. Thank you so much.",0.9246,"I want  to thank the sisters for their help to my child, They help me with a smle on thier face and a happy heart. Thank you so much.","much.,thier,heart.,child,,smle"
OP-DPOS-2023-398-488482,Tembisa Tertiary Hospital,Wound Clinic ,1,"Ke kgotsofetse ka tswaro ya bo sister. Ke batho ka lethoba.
Ke a ba leboga bana  ba rena ba kaone ka lebaka la bona ",0.0,"Kgotsofetse ka twaro of bo's sister.Keep the lethoba.
He is a legendary legendary","twaro,kgotsofetse,sister.keep,lethoba."
OP-DPOS-2023-398-234058,Tembisa Tertiary Hospital,Wound Clinic ,1,i'm very happy with the treatment that we getting here .. The staff is good. Thank you.,0.8553,i'm very happy with the treatment that we getting here .. The staff is good. Thank you.,"good.,you.,.."
OP-DPOS-2023-149-173062,Heidelberg District Hospital,EYE CLINIC,1,GOOD SERVICE,0.4404,Good service,
OP-DPOS-2023-149-873040,Heidelberg District Hospital,EYE CLINIC,1,GOOD SERVICE,0.4404,Good service,
OP-DPOS-2023-398-326178,Tembisa Tertiary Hospital,Wound Clinic ,0.89,Ke rata thutso e ke kgomane ko spetlele ba thutshise ngwana waka abe a tsle bohloko ba gne go mothusa a tlokomela wa bo thaga ke leboga thusoya bona kudu kudu thank you so much ,0.0,Kee rare thutso era kgomane ko spetlele and thutshise and abe a tsle bhloko gne gne gnome,"kgomane,thutshise,spetlele,bhloko,thutso,tsle,gne"
OP-DPOS-2023-149-362825,Heidelberg District Hospital,EYE CLINIC,1,GOOD SERVICE,0.4404,Good service,
OP-DPOS-2023-149-530143,Heidelberg District Hospital,WARD 3 MATERNITY ,1,"I received good are. The careworkers were very patient and responsible with their work. They showed compassion, empathy and ability. 

THANK YOU",0.9185,"I received good are. The careworkers were very patient and responsible with their work. They showed compassion, empathy and ability. 

THANK YOU","careworkers,are.,work.,ability.,compassion,"
OP-DPOS-2023-149-803112,Heidelberg District Hospital,WARD 3 MATERNITY ,0.5,I hape pain and I am 40 weeks and 2 days. ,-0.5106,I hape pain and I am 40 weeks and 2 days. ,"hape,days."
OP-DPOS-2023-149-184012,Heidelberg District Hospital,ALLIED,0.83,"The therapits was very good, kind and helpful. I was never turned away from the hospital. I like the way the audiologist greeted and listened to my concerns and she was very attentive. ",0.9227,"The therapits was very good, kind and helpful. I was never turned away from the hospital. I like the way the audiologist greeted and listened to my concerns and she was very attentive. ","hospital.,therapits,attentive.,good,,audiologist,helpful."
OP-DPOS-2023-149-661479,Heidelberg District Hospital,ALLIED,0.94,"I really appreciate the excellent treatment at the hospital, the staff is really doing a good job for the community.

Thank you",0.9124,"I really appreciate the excellent treatment at the hospital, the staff is really doing a good job for the community.

Thank you","community.,hospital,"
OP-DPOS-2023-149-187921,Heidelberg District Hospital,Therapeutic Services,1,The best service and treatment I have ever experienced and the Audilogist ever. The lady is true asset to the profession and the hospital. ,0.8591,The best service and treatment I have ever experienced and the Audilogist ever. The lady is true asset to the profession and the hospital. ,"hospital.,audilogist,ever."
OP-DPOS-2023-149-662473,Heidelberg District Hospital,Therapeutic Services,1,"Basotho mamelang, ke le bolelle ka bohlweki kere bgabane bamo kene keile teng kajeno. Ha ke so bone bohlweki bo bo kana. Kere motho aseke anhlokomela hantle legale antse abososelefela hake so bone nthwe jwalo. ke bua ka mang?ke bua ka ngwanana wa Mosotho bitso la hae ke Mmasina, kere pelo eya pele nganana Mosotho. ",0.0,"Basotho mamelang, but only bolelle ka bohlweki kere bgabane bamo Keile Teng Kajen.Ha ke are vouchers bohlweki will be henna.Kere Motho Askes Anhlocomela Hantle Legale Antse Abososelefel Hake are Bone Nthwe Jwalo.Being Bua Ka Ngwanana Wa Mosotho bitso la hae ka mmasina, kere sang sang sang nganana mosotho.","abososelefel,hantle,bua,bolelle,antse,henna.kere,teng,nganana,basotho,nthwe,mosotho.,anhlocomela,bamo,kere,bitso,mamelang,,jwalo.being,mmasina,,legale,kajen.ha,askes,keile,bgabane,bohlweki,mosotho,motho,ngwanana"
OP-DPOS-2023-149-288279,Heidelberg District Hospital,Therapeutic Services,0.83,No complaints,-0.5719,No complain,
OP-DPOS-2023-398-983838,Tembisa Tertiary Hospital,POPD,0.94,The nurses areally friendly and explain everything in an understandable manner,0.4939,The nurses areally friendly and explain everything in an understandable manner,areally
OP-DPOS-2023-398-699818,Tembisa Tertiary Hospital,POPD,0.78,"The nurses are patience when they talk to us as parents and when we ask them they have a perseverance and understanding us,im greatfull to get help, since I got here",0.4019,"The nurses are patience when they talk to us as parents and when we ask them they have a perseverance and understanding us,im greatfull to get help, since I got here","greatfull,us,im,help,"
OP-DPOS-2023-398-020020,Tembisa Tertiary Hospital,POPD,0.94,Nurses are friendly and approchable some of them,0.4939,Nurses are friendly and approchable some of them,approchable
OP-DPOS-2023-398-924194,Tembisa Tertiary Hospital,POPD,0.67,I'm happy ,0.5719,I'm happy,
OP-DPOS-2023-398-232369,Tembisa Tertiary Hospital,POPD,0.72,Please create activities for to keep them busy while waiting to be seen by doctors ,0.5267,Please create activities for to keep them busy while waiting to be seen by doctors ,
OP-DPOS-2023-398-664073,Tembisa Tertiary Hospital,POPD,0.83,The nurses were frinedly. Keep up the good work ,0.4404,The nurses were frinedly. Keep up the good work ,frinedly.
