﻿system_reference_number,facility_name,unit_name_and_description,form_score,patient_comments,Sentiment Score,Translated Text,Misspelled Words
OP-DPOS-2023-398-873621,Tembisa Tertiary Hospital,WHC,0.61,This hospital has a great company and they are available for you anytime. they know their job and they love their job mostly. they you to do this about your health,0.8519,This hospital has a great company and they are available for you anytime. they know their job and they love their job mostly. they you to do this about your health,"mostly.,anytime."
OP-DPOS-2023-398-866801,Tembisa Tertiary Hospital,Wound Clinic ,0.89,wound clinic ere swere ga botse  ga go seo re belaelago ka sona. ke  ka  mokgwa woo re kgothetsegoka gona o bana bo sister le Doctor ya rena bare swere ga botse ka nnete okare reka fetsa refed le ebile ga bare felele le pelo le rena re somisina le bona ga btse ekare modimo aka ba okeletsa matsatsi a bophelo,0.4767,Wound Clinic ER SWERE GA BOTSE GO SEO Re Belaelago Ka Sona.Ka ka mokgwa woo re kgotehetegoka gona o bana Bo Sister Le Doctor Ya Rena Bare swere gave botse ka ka nnee okare prawn fetsa refed le ebile only gave the felele le pelo le rena re rena re somisina le bona ga btse ekare modimo aka aka okeletsaa a bopheletsa a bopheletsaa a bopheletsaa a bopheletsaa a bopheletsaa a bopheletsaa a bopheletsaa a bopheletsaa a bopheletsaa a bopheletsaa a bopheletsaa a bopheletsi a bopheletsi a bopheletsi a bopheletsi a,"okeletsaa,bopheletsa,felele,swere,ebile,bopheletsaa,nnee,somisina,ekare,btse,botse,bopheletsi,okare,refed,fetsa,mokgwa,modimo,kgotehetegoka,sona.ka,belaelago"
OP-DPOS-2023-398-408305,Tembisa Tertiary Hospital,Wound Clinic ,0.89,i have recived  the out most professinal and most caring assistance. this is by far the best assisstance i have received at a hospital ,0.8268,i have recived  the out most professinal and most caring assistance. this is by far the best assisstance i have received at a hospital ,"assistance.,recived,assisstance,professinal"
OP-DPOS-2023-398-416313,Tembisa Tertiary Hospital,Wound Clinic ,0.89,Re leboga tshwaro ya mo Wound Clinic ya bo sister ga ba felelane pelo bana le tshwaro ye botse kudu re ya leboga ,0.0,Re Libya Ya Wound Clinic Ya Wa Sister Ya Pelo Bana Boate Ye Tye,boate
OP-DPOS-2023-398-907925,Tembisa Tertiary Hospital,Wound Clinic ,0.89,"They have good services and they do their work with love and care ,have with they job they are doing ",0.8834,"They have good services and they do their work with love and care ,have with they job they are doing ",",have"
OP-DPOS-2023-398-743652,Tembisa Tertiary Hospital,Wound Clinic ,0.89,thobela re thaba kgohlokomela ga botse ka mo kgge re dikwa re le kgabotse ga kele ba thata rea thaba ,0.0,Thobela Ra Thaba Kgohlokomela GA Botse Kige Kgge Re Dikwa Re Kgabotse GA Thaba,"kgabotse,botse,kgge,kige,kgohlokomela,dikwa,thaba,thobela"
OP-DPOS-2023-398-899620,Tembisa Tertiary Hospital,Wound Clinic ,0.89,im very happy ngendlela enhle engiphethwe nagaye la ekhaya ngiyabonga . kakhulu ngoba abosiler bengiphethe ka ble THANK SO MUCH,0.7574,im very happy ngendlela enhle engiphethwe nagaye la ekhaya ngiyabonga.kakhulu ngoba abosiler bengiphethe ka ble thank so much,"enhle,abosiler,nagaye,bengiphethe,ngendlela,ngiyabonga.kakhulu,engiphethwe,ngoba,ekhaya"
OP-DPOS-2023-398-167556,Tembisa Tertiary Hospital,Wound Clinic ,0.89,"ke sepela mo clinic ya di wound ke tsamaya btse kudu ga gona mathata ntho, yaka ya surgery e tsamaya  btse eya fola. Nna ke rata tswaro ya bona. Ba bereki ba gona bana le lerato le botho clinic ya bona e sekopna . re a leboga bareki ba Wound Clinic Letsware bjalo. Re a le rata",0.7297,"To the same time, the clinic is wound to Tsamaya btse not yet gona mathata ntho, yaka ya surgery e tsamaya btse eya fola.NNA KEAT TSWARO YES BONA.Ba Bereki Ba Gona Bana Le Lerato Le Botho Clinic Yes Bona E Selopna.Re A Leboga Bareki Ba Wound Clinic Letsware Bjalo.Re a le flat","time,,yaka,lerato,tswaro,leboga,tsamaya,bereki,eya,btse,ntho,,selopna.re,keat,bjalo.re,bona.ba,fola.nna,letsware,mathata,botho,bareki"
OP-DPOS-2023-398-542990,Tembisa Tertiary Hospital,Wound Clinic ,0.89,since i arrived in this clinic my situation is so impoving and im pleassed with their service. May God contiunes to use them for his people ,0.2732,since i arrived in this clinic my situation is so impoving and im pleassed with their service. May God contiunes to use them for his people ,"contiunes,pleassed,service.,impoving"
OP-DPOS-2023-398-450825,Tembisa Tertiary Hospital,Wound Clinic ,0.89,The nurses are friendly and always willing to help. they explain everything and  make sure we understand the procedure and the importancy of follow us visits. Big Up wound clinc staff ,0.8625,The nurses are friendly and always willing to help. they explain everything and  make sure we understand the procedure and the importancy of follow us visits. Big Up wound clinc staff ,"visits.,help.,importancy,clinc"
OP-DPOS-2023-398-820287,Tembisa Tertiary Hospital,SOPD,1,NDAFARIRA MABATIRO GAO THRIR HAVE WARM WELL COME AND MUCHIIC MAKACHERNA ,0.4588,NDAFARIRA MABATIRO GAO THRIR HAVE WARM WELL COME AND MUCHIIC MAKACHERNA ,"muchiic,mabatiro,ndafarira,thrir,makacherna"
OP-DPOS-2023-398-303026,Tembisa Tertiary Hospital,SOPD,1,"MOST OF ALL .OVERALL I APPRECIATE THE FACT THAT COMMUNICATION IS KEY, THIS WAY I  AM NEVER CONFUSED IN REGARDING ANYTHING RELATED TO THE SERVICE MY ALUGHTER AND I HAVE RECEIVED AT THE HOSPITAL. 

i ALSO PPRECIATE THE PRAYER SESSIONS, INVITING GOD BEFORE EVERYTHING. THE SOPD STAFF IS THE BEST YOU HAVE IN YOUR ENTIER HOSPITAL. PLEASE KEEP UP THE GOOD WORK LOVE GLORY BASITSANA ",0.9755,"MOST OF ALL .OVERALL I APPRECIATE THE FACT THAT COMMUNICATION IS KEY, THIS WAY I  AM NEVER CONFUSED IN REGARDING ANYTHING RELATED TO THE SERVICE MY ALUGHTER AND I HAVE RECEIVED AT THE HOSPITAL. 

i ALSO PPRECIATE THE PRAYER SESSIONS, INVITING GOD BEFORE EVERYTHING. THE SOPD STAFF IS THE BEST YOU HAVE IN YOUR ENTIER HOSPITAL. PLEASE KEEP UP THE GOOD WORK LOVE GLORY BASITSANA ","hospital.,alughter,everything.,basitsana,.overall,ppreciate,sessions,,sopd,key,,entier"
OP-DPOS-2023-398-105381,Tembisa Tertiary Hospital,SOPD,0.72,GOOD SERVICE,0.4404,Good service,
OP-DPOS-2023-398-598428,Tembisa Tertiary Hospital,SOPD,1,"i'm not good about , i have pay money for file but not geting help . since march till now. we gave me date after we gave me another date, i use transport to come so  i need help please ",-0.5157,"i'm not good about , i have pay money for file but not geting help . since march till now. we gave me date after we gave me another date, i use transport to come so  i need help please ","now.,date,"
OP-DPOS-2023-398-253199,Tembisa Tertiary Hospital,Wound Clinic,0.89,Everything went well and i have no complain the treatment was good,0.0772,Everything went well and i have no complain the treatment was good,
OP-DPOS-2023-398-483572,Tembisa Tertiary Hospital,Wound Clinic,0.89,I am happy with their services,0.5719,I am happy with their services,
OP-DPOS-2023-398-898855,Tembisa Tertiary Hospital,Wound Clinic,0.89,Wound Clinic the best and my pain is all most 80% and am happy and god please help others,0.8934,Wound Clinic the best and my pain is all most 80% and am happy and god please help others,80%
OP-DPOS-2023-321-397062,Rahima Moosa Regional Hospital,ANC,0.61,"Toilets areso dirty, even the hospital there is no clean place. As patients will yet sick from the dirtyness of this place, we have been complaining with no improvement.",-0.6908,"Toilets areso dirty, even the hospital there is no clean place. As patients will yet sick from the dirtyness of this place, we have been complaining with no improvement.","dirtyness,dirty,,improvement.,areso,place.,place,"
OP-DPOS-2023-321-428309,Rahima Moosa Regional Hospital,ANC,0.83,We are not happy with the toilets in antinental clinic please we need a change sometimes no water.,-0.4401,We are not happy with the toilets in antinental clinic please we need a change sometimes no water.,"water.,antinental"
OP-DPOS-2023-314-020245,Pretoria West District Hospital,Casualty department,0.83,The doctors were very friendly and assisted very well,0.7083,The doctors were very friendly and assisted very well,
OP-DPOS-2023-398-775906,Tembisa Tertiary Hospital,POPD,1,Good service!,0.4926,Good service!,service!
OP-DPOS-2023-398-207886,Tembisa Tertiary Hospital,POPD,0.78,Got a great service from all the staff and the doctor came in early. Thanks,0.7906,Got a great service from all the staff and the doctor came in early. Thanks,early.
OP-DPOS-2023-398-720858,Tembisa Tertiary Hospital,Masakhane,0.89,Everyday came to hospital i feel happy about work for doctor either I go to home on time,0.5719,Everyday came to hospital i feel happy about work for doctor either I go to home on time,
OP-DPOS-2023-398-245794,Tembisa Tertiary Hospital,Masakhane,1,I am satified with the services provided at this clinic,0.0,I am satified with the services provided at this clinic,satified
OP-DPOS-2023-398-243017,Tembisa Tertiary Hospital,Physitherapy,0.86,"The coolest place in the whole hospital, friendly staff, always ready to help. They are honetly interested inour health and give us hope that we will get better . MUsa is the best",0.9643,"The coolest place in the whole hospital, friendly staff, always ready to help. They are honetly interested inour health and give us hope that we will get better . MUsa is the best","honetly,staff,,hospital,,help.,inour"
OP-DPOS-2023-398-590849,Tembisa Tertiary Hospital,Physitherapy,0.86,Well presented . Good taken care help with good & nice smile ,0.9524,Well presented . Good taken care help with good & nice smile ,
OP-DPOS-2023-57-340960,Charlotte Maxeke Academic Hospital,"Premature low care 
Area 185",1,"The nurses are really helpful,  caring,  understanding and patient. I couldn't have asked for better as more passionate Healthcare workers.  Thank you so much for taking good care of our babies.  I am super grateful that my baby is in great hands ",0.9858,"The nurses are really helpful,  caring,  understanding and patient. I couldn't have asked for better as more passionate Healthcare workers.  Thank you so much for taking good care of our babies.  I am super grateful that my baby is in great hands ","patient.,caring,,workers.,helpful,,babies."
OP-DPOS-2023-57-682206,Charlotte Maxeke Academic Hospital,"Premature low care 
Area 185",1,"Thanks for everything,  always I am happy to see everything is perfect to my child ",0.8834,"Thanks for everything,  always I am happy to see everything is perfect to my child ","everything,"
OP-DPOS-2023-57-033854,Charlotte Maxeke Academic Hospital,"Premature low care 
Area 185",1,"I really appreciate all the nurses,  they are doing a very good job,  with a smile,  and they explain everything so well,  thank you ",0.9217,"I really appreciate all the nurses,  they are doing a very good job,  with a smile,  and they explain everything so well,  thank you ","smile,,well,,nurses,,job,"
OP-DPOS-2023-57-180757,Charlotte Maxeke Academic Hospital,"Premature low care 
Area 185",1,"I am happy with the nurses the way they care and they make sure we understand each and every single thing about the baby and we happy with the progress that we seeing from our babies.  We'll done and we appreciate them a lot, we pray for the spirit to keep on staying and with them forever ",0.9657,"I am happy with the nurses the way they care and they make sure we understand each and every single thing about the baby and we happy with the progress that we seeing from our babies.  We'll done and we appreciate them a lot, we pray for the spirit to keep on staying and with them forever ","lot,,babies."
OP-DPOS-2023-57-547233,Charlotte Maxeke Academic Hospital,"Premature low care 
Area 185",1,I am the mother everyday when come here I found my child clean and that makes me happy. I didn't never disappointment and also nurse take care never complain ,0.8573,I am the mother everyday when come here I found my child clean and that makes me happy. I didn't never disappointment and also nurse take care never complain ,happy.
OP-DPOS-2023-57-998481,Charlotte Maxeke Academic Hospital,"Premature low care 
Area 185",1,The staff is very friendly and welcoming.  I am proud of the service I get ,0.8676,The staff is very friendly and welcoming.  I am proud of the service I get ,welcoming.
OP-DPOS-2023-57-574385,Charlotte Maxeke Academic Hospital,"Premature low care 
Area 185",1,"Everything good, I  am happy ",0.765,"Everything good, I  am happy ","good,"
OP-DPOS-2023-398-084010,Tembisa Tertiary Hospital,Speech Theraphy,1,Had a great session. Thank you!,0.784,Had a great session. Thank you!,"session.,you!"
OP-DPOS-2023-398-841612,Tembisa Tertiary Hospital,Speech Theraphy,1,Seen was good thank you for verything.,0.6597,Seen was good thank you for verything.,verything.
OP-DPOS-2023-398-960744,Tembisa Tertiary Hospital,Speech Theraphy,1,"Thanks for the attendence, the theropy was a great success and we enjoyed the therapist's company and appreciate the manner he was towards the session.",0.9493,"Thanks for the attendence, the theropy was a great success and we enjoyed the therapist's company and appreciate the manner he was towards the session.","session.,theropy,attendence,"
OP-DPOS-2023-398-248696,Tembisa Tertiary Hospital,Psychology,1,Today was good and helpful,0.4404,Today was Good and Hellful,hellful
OP-DPOS-2023-398-741583,Tembisa Tertiary Hospital,Psychology,0.86,"Today's session in psychology was very eye opening, as it helped me to do self introspectation about some psychological difficulties I am facing It felt like a safe environment to be in and I am grateful for their king service.",0.7351,"Today's session in psychology was very eye opening, as it helped me to do self introspectation about some psychological difficulties I am facing It felt like a safe environment to be in and I am grateful for their king service.","introspectation,opening,,service."
OP-DPOS-2023-398-917854,Tembisa Tertiary Hospital,Psychology,1,"Todays session was very good and helpfu, aia felt a releaved and lighter. I will continue to come cause I can see process",0.4927,"Todays session was very good and helpfu, aia felt a releaved and lighter. I will continue to come cause I can see process","aia,lighter.,todays,releaved,helpfu,"
OP-DPOS-2023-398-459366,Tembisa Tertiary Hospital,Psychology,1,"Got to my appointment on time, the greeting is a warm welcoming. The service is great. They speakly nicely to people and assist when is needed ",0.9246,"Got to my appointment on time, the greeting is a warm welcoming. The service is great. They speakly nicely to people and assist when is needed ","welcoming.,speakly,great.,time,"
OP-DPOS-2023-398-164020,Tembisa Tertiary Hospital,Psychology,0.86,I had to tell nondumiso everything that hold me bad. but after talking to her every thing goes well couse he told me how mass i cope with my problem and i mass not give up for my self and keep up doing good job of my kinds and we will meet again and see who things and getting better or not.,0.6757,I had to tell nondumiso everything that hold me bad. but after talking to her every thing goes well couse he told me how mass i cope with my problem and i mass not give up for my self and keep up doing good job of my kinds and we will meet again and see who things and getting better or not.,"not.,bad.,nondumiso"
OP-DPOS-2023-398-141939,Tembisa Tertiary Hospital,Psychology,1,"The I am so happy with my psychologist and each and every time we meet of the secior I go home relived. This best psychology I ever had. and i also trying my best to do better even though it is not easy. Thank you so much 
from Simphiwe Dlamini",0.9264,"The I am so happy with my psychologist and each and every time we meet of the secior I go home relived. This best psychology I ever had. and i also trying my best to do better even though it is not easy. Thank you so much 
from Simphiwe Dlamini","simphiwe,had.,relived.,dlamini,easy.,secior"
OP-DPOS-2023-398-225715,Tembisa Tertiary Hospital,Masakhane,1,I'm well treated in this clinic. Doctors and sisters always smilling to me. Explain every medicine they gave me well.,0.4939,I'm well treated in this clinic. Doctors and sisters always smilling to me. Explain every medicine they gave me well.,"smilling,me.,well.,clinic."
OP-DPOS-2023-398-555806,Tembisa Tertiary Hospital,Masakhane,1,"Yes, I have comments I am satisfied the way doctor Mashudu Introduced herself to me she greet with a smile the hospital/ clinic is clean and well lit no papers around the clinic/ hospital and water is availabe and also toilet paper are available toilet are flushing well, I have never been fumed way here at hospital Masakhane medication is not expired.",0.9364,"Yes, I have comments I am satisfied the way doctor Mashudu Introduced herself to me she greet with a smile the hospital/ clinic is clean and well lit no papers around the clinic/ hospital and water is availabe and also toilet paper are available toilet are flushing well, I have never been fumed way here at hospital Masakhane medication is not expired.","mashudu,availabe,clinic/,yes,,hospital/,well,,expired.,masakhane"
OP-DPOS-2023-398-325899,Tembisa Tertiary Hospital,Masakhane,1,I am certisfied on embisa hospital beacause they treat us great.,0.7783,I am certisfied on embisa hospital beacause they treat us great.,"great.,embisa,certisfied"
OP-DPOS-2023-398-756389,Tembisa Tertiary Hospital,Masakhane,1,Satisfied,0.4215,Satisfied,
OP-DPOS-2023-398-137152,Tembisa Tertiary Hospital,Masakhane,1,"Every day when I come here they welcome me friendly, and all staff are hard workers and they are willing to help everybody.",0.8176,"Every day when I come here they welcome me friendly, and all staff are hard workers and they are willing to help everybody.","friendly,,everybody."
OP-DPOS-2023-398-868650,Tembisa Tertiary Hospital,Masakhane,0.83,"The information I received today helped me a lot on things I dont or didn't know. It helped me acknowledge my mistakes and have a pasion to drink my medication on time on a daily basis. I realised that not taking my medication everyday on time for my own personal health all thanks to our kind, loving patient and caring nurses. Love them",0.9442,"The information I received today helped me a lot on things I dont or didn't know. It helped me acknowledge my mistakes and have a pasion to drink my medication on time on a daily basis. I realised that not taking my medication everyday on time for my own personal health all thanks to our kind, loving patient and caring nurses. Love them","nurses.,know.,kind,,basis.,pasion"
OP-DPOS-2023-398-157969,Tembisa Tertiary Hospital,Masakhane,0.89,I am well happy with the service of this clinic  we are always welcomed Thank very much for the kind job. Keep being your staff,0.9201,I am well happy with the service of this clinic  we are always welcomed Thank very much for the kind job. Keep being your staff,job.
OP-DPOS-2023-398-425697,Tembisa Tertiary Hospital,Wound Clinic,0.89,"Rena mo wound clinic re swerwe ga botseka diatla tse pedi gore ha bathata le bo sisters ba rena le yona doctor ya rena ga ena bothata re phedisana le bona ga botse ebile ga ba re felele di pelo ba boha tswelopelo reya fola re tswela pele ga re boele morago o kare modimo aka bao ke letsa matsatsi a bophelo, re ya ba ra pedisa ka mehla re ya ithamedisa.",0.34,"Rena mo wound clinic re swerwe ga botseka diatla tse pedi gore ha bathata le bo sisters ba rena le yona doctor ya rena ga ena bothata re phedisana le bona ga botse ebile ga ba re felele di pelo ba boha tswelopelo reya fola re tswela pele ga re boele morago o kare modimo aka bao ke letsa matsatsi a bophelo, re ya ba ra pedisa ka mehla re ya ithamedisa.","kare,felele,matsatsi,ebile,swerwe,fola,pedisa,bophelo,,phedisana,bathata,yona,mehla,botseka,boele,botse,ithamedisa.,morago,letsa,modimo,boha,diatla,bothata,tswelopelo,reya,tswela,ena"
OP-DPOS-2023-398-908966,Tembisa Tertiary Hospital,Wound Clinic,0.89,"I would like to thank the team at wound clinic they are so welcoming, friendly with smile, treatng each patient with friendly and respectful manner. I m really say big up to wound clinic team.",0.9647,"I would like to thank the team at wound clinic they are so welcoming, friendly with smile, treatng each patient with friendly and respectful manner. I m really say big up to wound clinic team.","manner.,m,treatng,welcoming,,smile,,team."
OP-DPOS-2023-398-338992,Tembisa Tertiary Hospital,Wound Clinic,1,"Friendlyness and good communication is on a tpo level.
When you have questions you get answers.
Keep up the good work!!",0.7494,"Friendlyness and good communication is on a tpo level.
When you have questions you get answers.
Keep up the good work!!","tpo,work!!,level.,friendlyness,answers."
OP-DPOS-2023-398-022384,Tembisa Tertiary Hospital,Wound Clinic,0.94,Thank you very wound clinic. You did a great job. Thanks amas Phuthi thank you sister May bless you. My mother is very good because of you sister. I dont know what to say to you sister phuti. The love you give us and the treatment is so good you deserve good things. Thank you for your support and being patient to us My mother say thank you very much,0.9875,Thank you very wound clinic. You did a great job. Thanks amas Phuthi thank you sister May bless you. My mother is very good because of you sister. I dont know what to say to you sister phuti. The love you give us and the treatment is so good you deserve good things. Thank you for your support and being patient to us My mother say thank you very much,"job.,you.,things.,clinic.,sister.,phuthi,phuti.,amas"
OP-DPOS-2023-398-135281,Tembisa Tertiary Hospital,Wound Clinic,1,Staff is always friendly and willing to assist. My visits are always quick and effeciants.,0.4939,Staff is always friendly and willing to assist. My visits are always quick and effeciants.,"effeciants.,assist."
OP-DPOS-2023-398-482045,Tembisa Tertiary Hospital,Wound Clinic,0.89,Mina ngiyabonga kakhulu indlela engiphathwe ngayo la ekhaya ngiyaphathwe kahle kakhulu ngendlela enhle kakhulu. Thanks so much.,0.0,Mina ngiyabonga kakhulu indlela engiphathwe now la ekhaya ngiyaphathwe kahle kakhulu ngendlela enhle kakhulu.Thanks so much.,"ngiyabonga,engiphathwe,ngiyaphathwe,much.,enhle,kahle,ngendlela,kakhulu.thanks,indlela,kakhulu,ekhaya"
OP-DPOS-2023-398-054133,Tembisa Tertiary Hospital,Wound Clinic,0.89,Service was good.,0.4404,Service was good.,good.
OP-DPOS-2023-398-110476,Tembisa Tertiary Hospital,Wound Clinic,0.89,"In wound clinic they care of people and they have patients when they treat a patient, I love and care, they treat you on time they dont delay a patient. in wound clinic u get a proper care you want at any time Thank you wound clinic doctors and nurses Thank you for taking care of patient with love.",0.986,"In wound clinic they care of people and they have patients when they treat a patient, I love and care, they treat you on time they dont delay a patient. in wound clinic u get a proper care you want at any time Thank you wound clinic doctors and nurses Thank you for taking care of patient with love.","patient,,patient.,love.,care,"
OP-DPOS-2023-398-935125,Tembisa Tertiary Hospital,Wound Clinic,1,The service at this department is super excellent. The nurses are always wiliing to help and always smilling. Big up wound clinic staff.,0.8834,The service at this department is super excellent. The nurses are always wiliing to help and always smilling. Big up wound clinic staff.,"excellent.,smilling.,wiliing,staff."
OP-DPOS-2023-398-566841,Tembisa Tertiary Hospital,Wound Clinic,0.89,Thobela ka la peng re thaba kgo hloko mela kga botse go swara kga mote kamo kgae bare hloko mela kgabo tse ka mo kgae rea le bokga.,0.0,Thobela ka la peng re thaba kgo hloko mele kga botse go swara kga kama kama bare hlko mela kgabo ka ka ka ka kgae real le boiles.,"boiles.,botse,mela,hlko,swara,kgo,kgae,kgabo,thaba,thobela,kga,hloko"
OP-DPOS-2023-398-192505,Tembisa Tertiary Hospital,Wound Clinic,1,Ke tsamaile mo woundclinic ke sepetse ga botse. ke tswerwe ka erato smile kwele bohloko ke manese a mo ke thoma gobona bonese ba lerato balo ka ba ke leboga ke kgotsofetse ebile ke tswile discharge Bonese le tsware bjalo ka mokgoa wo le berekang ka gona. ke a le lerato modimo a le hlogonolofatse.,0.4767,Ke tsamaile mo woundclinic ke sepetse ga bleses.ke tswerwe ka erato smiles quelle bohloko ke manesis a mo ke thoma gobona bonese ba lerato balo ka ba ke leboga ke kgotsofetse ebile ke tswile discharge bonese le tware bjalo ka mokgoa wo le gona.Ke a le lerato modimo a le hlogonolophatse.,"lerato,bonese,ebile,tswerwe,leboga,tswile,erato,hlogonolophatse.,bleses.ke,balo,tsamaile,gobona,manesis,tware,gona.ke,mokgoa,modimo,bjalo,sepetse,bohloko,thoma,kgotsofetse,woundclinic"
OP-DPOS-2023-398-185746,Tembisa Tertiary Hospital,Wound Clinic,0.86,Excellent work,0.5719,Excellent Work,
OP-DPOS-2023-367-265977,Sizwe Tropical Disease Hospital,OPD,1,In this hospital patients are treated well and taken care of nurses and doctors are friendly and able to assist with everything even the helpers are there for patients. The invironment is clean and clothes are washed for patients to change. If any person need help I will definethly recommand the hospital.,0.9325,In this hospital patients are treated well and taken care of nurses and doctors are friendly and able to assist with everything even the helpers are there for patients. The invironment is clean and clothes are washed for patients to change. If any person need help I will definethly recommand the hospital.,"patients.,hospital.,definethly,recommand,invironment,change."
OP-DPOS-2023-367-737420,Sizwe Tropical Disease Hospital,OPD,1,"The servise is always excellent and welcoming. Staff very helpful and friendly.
",0.921,"The servise is always excellent and welcoming. Staff very helpful and friendly.
","welcoming.,servise,friendly."
